{
  "quantity": 1,
  "name": "ALDAMIR, SON OF ELDACAR",
  "stats": {
    "M": 3.5,
    "WS": 5,
    "BS": 4,
    "S": 4,
    "T": 4,
    "W": 2,
    "I": 4,
    "A": 3,
    "Ld": "8+1",
    "Int": 7,
    "Cl": 7,
    "WP": 7
  },
  "weapons": "Hand Weapon",
  "armor": "Light + Shield (Save 5+)",
  "special": "Hand Weapons provide no special benefit."
}