{
  "quantity": 15,
  "name": "NORTHMEN INFANTRY (SWORDS)",
  "stats": {
    "M": 3.5,
    "WS": 3,
    "BS": 3,
    "S": 3,
    "T": 3,
    "W": 1,
    "I": 3,
    "A": 1,
    "Ld": 7,
    "Int": 7,
    "Cl": 7,
    "WP": 7
  },
  "weapons": "Hand Weapons",
  "armor": "Light + Shield (Save 5+)",
  "special": "Hand Weapons provide no special benefit."
}