{
    "quantity":  13,
    "name":  "NORTHMEN WARHORSES",
    "stats":  {
                  "M":  7,
                  "WS":  3,
                  "BS":  0,
                  "S":  4,
                  "T":  3,
                  "W":  "-",
                  "I":  3,
                  "A":  1,
                  "Ld":  "-",
                  "Int":  "-",
                  "Cl":  "-",
                  "WP":  "-"
              },
    "armor":  "Warhorse (Save ^)"
}