{
  "quantity": 18,
  "name": "ROHAN SPEARMEN",
  "stats": {
    "M": 3.5,
    "WS": 3,
    "BS": 3,
    "S": 3,
    "T": 3,
    "W": 1,
    "I": 3,
    "A": 1,
    "Ld": 7,
    "Int": 7,
    "Cl": 7,
    "WP": 7
  },
  "weapons": "Spears (8\")",
  "armor": "Light + Shield (Save 5+)",
  "special": "Spears provide +1 I during 1st round of Combat (+3 vs mounted). Spears add +2 I during any other combat round vs mounted if the spearmen have NOT been pushed-back. 2nd rank allowed to fight with every other model."
}