{
  "quantity": 1,
  "name": "BRUTE!",
  "stats": {
    "M": 3.5,
    "WS": 5,
    "BS": 4,
    "S": 4,
    "T": 4,
    "W": 3,
    "I": 5,
    "A": 3,
    "Ld": "9+2",
    "Int": 7,
    "Cl": "8+1",
    "WP": "8+1"
  },
  "weapons": "Hand Weapon",
  "armor": "Light + Shield (Save 5+)",
  "special": "Hand Weapons provide no special benefit."
}