{
  "quantity": 18,
  "name": "GONDORIAN ARCHERS",
  "stats": {
    "M": 4,
    "WS": 3,
    "BS": 3,
    "S": 3,
    "T": 3,
    "W": 1,
    "I": 3,
    "A": 1,
    "Ld": 7,
    "Int": 7,
    "Cl": 7,
    "WP": 7
  },
  "weapons": "Longbows (30\")",
  "armor": "Light (Save 6+)",
  "special": "Longbows (30\") fire at S3 and provide a -1 save modifer for shots up to half range."
}