{
  "quantity": 9,
  "name": "ROHIRRIM SWORDSMEN (MOUNTED)",
  "stats": {
    "M": "*",
    "WS": 3,
    "BS": 3,
    "S": 3,
    "T": 3,
    "W": 1,
    "I": 3,
    "A": 1,
    "Ld": 7,
    "Int": 7,
    "Cl": 7,
    "WP": 7
  },
  "weapons": "Hand Weapons",
  "armor": "Light + Shield (Save 4+)",
  "special": "Hand Weapons wielded by mounted troops provide a +1 to hit vs foot troops under 10' tall. This bonus does NOT apply if the mounted troops were pushed back in the previous combat round."
}