{
  "quantity": 1,
  "name": "COLD ONE MOUNT",
  "stats": {
    "M": 8,
    "WS": 3,
    "BS": 0,
    "S": 4,
    "T": 4,
    "W": 2,
    "I": 1,
    "A": 2,
    "Ld": 2,
    "Int": 4,
    "Cl": 9,
    "WP": 9
  },
  "weapons": "Claws (-2 to enemy saves)",
  "armor": "None",
  "psychology": "Fear, stupidity",
  "special": "Slow charge, stinky"
}
