{
  "name": "VIDUSTAIN, LEVEL 15",
  "stats": {
    "M": "*",
    "WS": 5,
    "BS": 4,
    "S": 4,
    "T": 4,
    "W": 3,
    "I": 5,
    "A": 3,
    "Ld": "9+2",
    "Int": 7,
    "Cl": "8+1",
    "WP": "8+1"
  },
  "weapons": "Hand Weapon",
  "armor": "Light + Shield (Save 4+)",
  "special": "Hand Weapons wielded by mounted troops provide a +1 to hit vs foot troops under 10' tall. This bonus does NOT apply if the mounted troops were pushed back in the previous combat round."
}