{
  "quantity": 1,
  "name": "TROGLODYTE",
  "stats": {
    "M": 4, "WS": 3, "BS": 3, "S": 4, "T": 4, "W": 2,
    "I": 1, "A": 2, "Ld": 9, "Int": 4, "Cl": 9, "WP": 9
  },
  "weapons": "Double Handed Weapon",
  "armor": "None",
  "psychology": "Fear, stupidity",
  "special": "+1 WS each human devoured (max +3)"
}
