{
  "quantity": 5,
  "name": "BULL SLANN RIDERS",
  "stats": {
    "M": 4,
    "WS": 4,
    "BS": 2,
    "S": 3,
    "T": 4,
    "W": 1,
    "I": 4,
    "A": 1,
    "Ld": 8,
    "Int": 7,
    "Cl": 9,
    "WP": 9
  },
  "weapons": "Hand Weapon & Spear",
  "armor": "Light Armour & Shield (Save 5+)"
}
